"Policy initiative ID","English name","Original name(s)","Acronym","Description","Start date","End date","Budget amount(in local currency)","Background","Objective(s)","Responsible organisation(s)","Public access URL","Is evaluated ?","Evaluation URL","Yearly budget range","Country","Theme area(s)","Theme(s)","Target group type(s)","Target group(s)","Policy instrument ID","Policy instrument type category","Policy instrument type","Policy instrument name","Policy instrument description(s)","Policy instrument note(s)","Policy instrument mini-field(s)"
"http://stip.oecd.org/2019/data/policyInitiatives/16866","CHINESE ASSOCIATION FOR ARTIFICIAL INTELLIGENCE","中国人工智能学会","CAAI","The association was established to support research on AI in China.","1981","","","","To support research on AI in China.","Chinese Association for Artificial Intelligence (CAAI;中国人工智能学会)","","false","","Don't know","China","Emerging trends in STI policy","Artificial intelligence (AI)","Research and education organisations|Researchers, students and teachers","Established researchers|PhD students|Postdocs and other early-career researchers|Public research institutes","http://stip.oecd.org/2019/data/policyInitiatives/16866/instrument/14155","Guidance, regulation and incentives","Science and innovation challenges, prizes and awards","","","","Selection type: Ex-post (based on a scientific achievement or developed innovation)|Type of challenge: Research challenge, i.e. centred on a specific domain of science or technology|Type of reward: Monetary"
"http://stip.oecd.org/2019/data/policyInitiatives/16868","NATIONAL ENGINEERING LABORATORY FOR DEEP LEARNING","深度学习技术及应用国家工程实验室","","The laboratory was established to accelerate research related to AI.","2017","","","In February 2017, the National Development and Reform Commission of the People's Republic of China approved a Chinese multinational technology company Baidu, Inc to take the lead in work of the National Engineering Laboratory for Deep Learning. The laboratory is co-established with universities and public research organisations, e.g. Tsinghua University, Beijing University of Aeronautics and Astronautics, China Information and Communication Research Institute, China Electronics Technology Standardization Institute","To support research and commercial applications of AI.","National Development and Reform Commission (NDRC;国家发展改革委)","https://baike.baidu.com/item/%E6%B7%B1%E5%BA%A6%E5%AD%A6%E4%B9%A0%E6%8A%80%E6%9C%AF%E5%8F%8A%E5%BA%94%E7%94%A8%E5%9B%BD%E5%AE%B6%E5%B7%A5%E7%A8%8B%E5%AE%9E%E9%AA%8C%E5%AE%A4/20441561?fr=aladdin","false","","Don't know","China","Emerging trends in STI policy|Public research system","Artificial intelligence (AI)|Non-competitive research funding|Research infrastructures and large equipment","Firms by age|Firms by size|Governmental entities|Research and education organisations","Firms of any age|Firms of any size|Higher education institutes|National government|Public research institutes","http://stip.oecd.org/2019/data/policyInitiatives/16868/instrument/14156","Collaborative infrastructures (soft and physical)","Networking and collaborative platforms","","","","Exchanges take place via: Online platform|Focus: Business innovation-oriented, Technology-oriented, Research-oriented|Objective(s): Promote business partnerships (e.g. consortia-building)|Ownership of IP stemming from science-industry research: Not applicable|Share of the platform's funding coming from the private sector (as a % of total funding): 1-25%"
"http://stip.oecd.org/2019/data/policyInitiatives/24274","THE NEXT GENERATION FOR ARTIFICIAL INTELLIGENCE PLAN","新一代人工智能发展规划","","The plan involves initiatives and goals for R&D, industrialization, talent development, education and skills acquisition, standard setting and regulations, ethical norms, and security.","2017","","","","It is a three step plan: <br/>i. Make China’s AI industry “in-line” with competitors by 2020.ii. To reach “world-leading” in some AI fields by 2025.iii. To become the “primary” center for AI innovation by 2030. By 2030, the government aims to cultivate an AI industry worth 1 trillion RMB, with related industries worth 10 trillion RMB. In addition, the government has also partnered with national tech companies to develop research and industrial leadership in specific fields of AI and will build a $2.1 billion technology park for AI research in Beijing.","The State Council for the People’s Republic of China (;国务院)","http://fi.china-embassy.org/eng/kxjs/P020171025789108009001.pdf","false","","Don't know","China","Emerging trends in STI policy","Artificial intelligence (AI)","Firms by size","Firms of any size","http://stip.oecd.org/2019/data/policyInitiatives/24274/instrument/17805","Governance","National strategies, agendas and plans","","The Plan outlines a three-step strategy which will guide China to achieve:<br/><br/>By 2020: one of the world’s most advanced level of AI technologies. By then, AI should have become an important driver of economic growth (value of core AI industries to reach 150 billion RMB, while that of AI-related industries to reach 1 trillion RMB), with several enterprises possessing world-leading competitiveness especially in a series of technology breakthroughs (e.g. in intelligent big data, intelligent cross-media, swarm intelligence, hybrid enhanced intelligence, and indigenous intelligent systems)<br/><br/>By 2025: the world’s leading level for some sets of AI technologies and their application, and major breakthroughs for fundamental AI theories. By then, AI should have been well applied in areas such as smart manufacturing, smart healthcare, smart cities, smart agriculture, and national defense, with the value of core AI industries to reach 400 billion RMB, while that of AI-related industries to reach 5 trillion RMB. The year 2025 will also mark the preliminary establishment of a new legal framework for AI, including standards, safety assessments, and supervision.<br/><br/>By 2030: the world’s leading levels in all AI theories, technologies and applications. By then, China should have become the global centre for AI technologies and Ai economy (value of core AI industries to exceed 1 trillion RMB, while that of AI-related industries to exceed 10 trillion RMB), with a deep and integrated IP application any production segments, social governance, as well as national security and defence, with a series of top-notch AI technology innovation bases and talents leading globally.","","Degree of coordination in implementing strategy (select the highest that applies): 1- Strategy communicated to public bodies|Focuses on the following area(s) of the national innovation system: Research, Business (innovation and/or entrepreneurship), Education and skills, Governance|Follow-up mechanism: None|Foresight exercise included: Yes|Societal challenge(s) emphasised: None specifically emphasised|Specific business sector(s) targeted: Telecommunications and IT|Strategy mainly prioritises: STI policy governance (e.g. vertical and horizontal coordination, evaluation), R&D intensity (e.g. GERD as a % of GDP), Specific areas/sectors (e.g. new industrial policy, R&D targets for clean tech)"
"http://stip.oecd.org/2019/data/policyInitiatives/24426","NATIONAL NEW GENERATION ARTIFICIAL INTELLIGENCE GOVERNANCE EXPERT COMMITTEE","国家新一代人工智能治理专委会","","","2019","","","","","","http://fi.china-embassy.org/eng/kxjs/P020171025789108009001.pdf","false","","","China","Emerging trends in STI policy","Artificial intelligence (AI)","","","http://stip.oecd.org/2019/data/policyInitiatives/24426/instrument/17740","Governance","Formal consultation of stakeholders or experts","","","",""
"http://stip.oecd.org/2019/data/policyInitiatives/24427","PRINCIPLES OF NEXT-GENERATION AI GOVERNANCE - DEVELOPMENT OF RESPONSIBLE AI","新一代人工智能治理原则——发展负责任的人工智能","","It highlights the theme of developing responsible artificial intelligence, emphasizing eight principles of harmony, friendliness, fairness, inclusiveness, respect for privacy, security and controllability, shared responsibility, open collaboration, and agile governance.","2019","","","In recent years, the rapid development of artificial intelligence is profoundly changing the life of human society and changing the world. In order to promote the healthy development of a new generation of artificial intelligence, strengthen the research on artificial intelligence law, ethics and social issues, and actively promote the global governance of artificial intelligence, the new generation artificial intelligence development planning promotion office established the national new generation artificial intelligence governance professional committee.<br/><br/>On 17 June 2019, the National New Generation Artificial Intelligence Governance Professional Committee issued the ""New Generation of Artificial Intelligence Governance Principles - Development of Responsible Artificial Intelligence"", and proposed a framework and action guide for artificial intelligence governance.","The aim is to coordinate better the relationship between the development and governance of AI, ensure that AI is safe and controllable, promote economic, social and ecological sustainable development, and build a community of human destiny.","Ministry of Science and Technology (MOST;科学技术部)","http://most.gov.cn/kjbgz/201906/t20190617_147107.htm","false","","Not applicable","China","Emerging trends in STI policy","Ethics of emerging technologies","Social groups especially emphasised","Civil society","http://stip.oecd.org/2019/data/policyInitiatives/24427/instrument/17741","Governance","Regulatory oversight and ethical advice bodies","","","","Activities: Provide guidance, advice and support to stakeholders|Challenge(s) addressed: Unethical use (e.g. dual-use technologies)|Reports are publicly available: Yes|Reports to: Ministry|The coordination body is composed of: Mostly government representatives|Type(s) of oversight or advice: Ethical principles (e.g. integrity, accountability, impartiality)"
"http://stip.oecd.org/2019/data/policyInitiatives/24470","BEIJING NATIONAL NEW-GENERATION AI INNOVATION & DEVELOPMENT PILOT ZONE","国家新一代人工智能创新发展试验区","","The zone will focus on exploring an innovative system to develop the AI technology and launching platforms for AI application through coordinating efforts of the government, academia and the industry，aiming to develop AI-related theories, ideas and talent.","2019","","","","To offer clues for authorities to deliberate AI-related policies and regulations that are conducive to the healthy development of the industry.","Ministry of Science and Technology (MOST;科学技术部)","","true","","Don't know","China","Emerging trends in STI policy","Artificial intelligence (AI)","Firms by size","Firms of any size","http://stip.oecd.org/2019/data/policyInitiatives/24470/instrument/21589","Governance","National strategies, agendas and plans","","","","Degree of coordination in implementing strategy (select the highest that applies): 1- Strategy communicated to public bodies|Focuses on the following area(s) of the national innovation system: Governance|Follow-up mechanism: Linked to new law or regulation|Foresight exercise included: Yes|Societal challenge(s) emphasised: None specifically emphasised|Specific business sector(s) targeted: Telecommunications and IT|Strategy mainly prioritises: STI policy governance (e.g. vertical and horizontal coordination, evaluation)"
"http://stip.oecd.org/2019/data/policyInitiatives/24471","THREE-YEAR GUIDANCE FOR INTERNET PLUS ARTIFICIAL INTELLIGENCE PLAN","促进新一代人工智能产业发展三年行动计划(2018-2020年)","","China’s ‘Three-year Guidance for Internet Plus Artificial Intelligence Plan (2016-2018)’ focuses on: <br/>i) enhancing AI hardware capacity, ii) strong platform ecosystems, iii) AI applications in important socioeconomic areas, and iv) AI’s impact on society.","2016","2018","","","To create a USD 15 billion market by 2018 by investing in research and supporting the development of the Chinese AI industry.","Minister of Industry and Information Technology (MIIT;工信部)","","false","","Don't know","China","Emerging trends in STI policy","Artificial intelligence (AI)","Firms by size","Firms of any size","http://stip.oecd.org/2019/data/policyInitiatives/24471/instrument/21820","Governance","National strategies, agendas and plans","","","","Degree of coordination in implementing strategy (select the highest that applies): 2- Public bodies are expected to plan activities based on strategy|Focuses on the following area(s) of the national innovation system: Research, Business (innovation and/or entrepreneurship), Education and skills, Governance|Follow-up mechanism: None|Foresight exercise included: No|Societal challenge(s) emphasised: None specifically emphasised|Specific business sector(s) targeted: Telecommunications and IT|Strategy mainly prioritises: STI policy governance (e.g. vertical and horizontal coordination, evaluation), Specific areas/sectors (e.g. new industrial policy, R&D targets for clean tech), Public research capabilities"